{
  "$schema": "https://json-schema.org/draft/2020-12/schema",
  "$id": "https://stamped.energy/schemas/finding.v1.json",
  "title": "Finding",
  "description": "L3 → L4 structured finding. Numeric intelligence only — no prose. v1.2.0 adds value_domain (two-pillar) + equipment-health categories. Additive optional intake-floor fields (detector_id, detector_version, decision_family_id, condition_key / condition_key_material, constraint_refs_considered) do not bump schema_version — dual-read stays 1.2.0. See technical/03-two-pillar-technical-bridge.md · ADR-020 · technical/l4/15-l3-l4-interface.md.",
  "type": "object",
  "required": [
    "schema_version",
    "finding_id",
    "org_id",
    "plant_id",
    "category",
    "value_domain",
    "waste_category",
    "assets",
    "evidence",
    "confidence",
    "estimated_monthly_kwh",
    "estimated_monthly_inr",
    "urgency",
    "engine",
    "engine_version",
    "rule_or_model_ref",
    "ops_clearance",
    "dedupe_key"
  ],
  "properties": {
    "schema_version": {
      "type": "string",
      "pattern": "^\\d+\\.\\d+\\.\\d+$",
      "const": "1.2.0"
    },
    "finding_id": { "type": "string", "minLength": 1 },
    "org_id": { "type": "string", "minLength": 1 },
    "plant_id": { "type": "string", "minLength": 1 },
    "detector_id": {
      "type": "string",
      "minLength": 1,
      "description": "Optional L4 intake floor (ADR-033 / doc 07) — detector identity. Missing at intake → reject in runtime, not a schema break."
    },
    "detector_version": {
      "type": "string",
      "minLength": 1,
      "description": "Optional L4 intake floor — detector version pin. Uncertified versions are shadow-only."
    },
    "decision_family_id": {
      "type": "string",
      "minLength": 1,
      "description": "Optional L4 intake floor — family registry id (primary domain is derived from this, not chosen by a model)"
    },
    "condition_key": {
      "type": "string",
      "minLength": 1,
      "description": "Optional precomputed shared key. If absent, L4 computes from condition_key_material (or enough existing fields)."
    },
    "condition_key_material": {
      "type": "object",
      "description": "Ingredients for the shared condition-key function (asset, state window, shift). Alternative to a precomputed condition_key.",
      "properties": {
        "asset_ids": {
          "type": "array",
          "items": { "type": "string", "minLength": 1 },
          "minItems": 1
        },
        "state_window": {
          "type": "string",
          "minLength": 1,
          "description": "ISO-8601 interval"
        },
        "shift_id": { "type": "string", "minLength": 1 }
      },
      "additionalProperties": false
    },
    "constraint_refs_considered": {
      "type": "array",
      "items": { "type": "string", "minLength": 1 },
      "description": "Optional L4 intake floor — constraint ids L3 already considered"
    },
    "category": {
      "type": "string",
      "enum": [
        "md_overlap",
        "md_exceedance_risk",
        "pf_slab_breach",
        "pf_leading",
        "tod_exposure",
        "compressor_sp_drift",
        "furnace_holding",
        "idle_load",
        "sec_drift",
        "dispatch_gap",
        "cop_degradation",
        "cmd_oversized",
        "trip_cascade_risk",
        "abnormal_duty",
        "feeder_unexplained_draw",
        "air_leak_survey"
      ]
    },
    "value_domain": {
      "type": "string",
      "enum": ["energy_efficiency", "equipment_health"],
      "description": "Pillar 1 Load & Energy Efficiency = energy_efficiency; Pillar 2 Prescriptive Equipment Intelligence = equipment_health (03-two-pillar-technical-bridge)"
    },
    "decision_class": {
      "type": "string",
      "enum": [
        "maint",
        "mgmt_schedule",
        "mgmt_capacity",
        "mgmt_cross_dept"
      ],
      "description": "Optional ADR-024 taxonomy — management classes feed TradeoffEngine"
    },
    "waste_category": {
      "type": "integer",
      "minimum": 1,
      "maximum": 6,
      "description": "1=MD/PQ 2=furnace 3=idle 4=compressed air 5=HVAC 6=source mix"
    },
    "assets": {
      "type": "array",
      "items": { "type": "string", "minLength": 1 },
      "minItems": 1
    },
    "evidence": {
      "type": "object",
      "required": ["metric", "baseline_value", "actual_value", "window"],
      "properties": {
        "metric": { "type": "string" },
        "baseline_value": { "type": "number" },
        "actual_value": { "type": "number" },
        "window": {
          "type": "string",
          "description": "ISO8601 interval e.g. 2026-06-15T00:00:00Z/2026-07-05T00:00:00Z"
        },
        "baseline_id": { "type": "string" },
        "baseline_band": {
          "type": "array",
          "items": { "type": "number" },
          "minItems": 2,
          "maxItems": 2
        },
        "supporting_tags": {
          "type": "array",
          "items": { "type": "string" }
        },
        "model_version": { "type": "string" },
        "rule_version": { "type": "string" }
      },
      "additionalProperties": false
    },
    "confidence": { "type": "number", "minimum": 0, "maximum": 1 },
    "estimated_monthly_kwh": { "type": "number", "minimum": 0 },
    "estimated_monthly_inr": { "type": "number", "minimum": 0 },
    "inr_decomposition": {
      "type": "object",
      "properties": {
        "bill_line": { "type": "string" },
        "rate_ref": { "type": "string" },
        "formula_id": {
          "type": "string",
          "description": "formula_registry id for calculator-owned cite"
        },
        "kvar_needed": {
          "type": "string",
          "description": "PF correction magnitude as decimal string"
        }
      },
      "additionalProperties": false
    },
    "urgency": { "type": "string", "enum": ["low", "medium", "high"] },
    "engine": { "type": "string" },
    "engine_version": { "type": "string" },
    "rule_or_model_ref": { "type": "string" },
    "suppressions_checked": {
      "type": "array",
      "items": { "type": "string" }
    },
    "ops_clearance": {
      "type": "object",
      "description": "Machine-evalable clearance contract for L5 ops-first verification (ADR-020)",
      "required": [
        "measurement_boundary",
        "related_tag_ids",
        "clearance_predicate",
        "expected_post_fix_signal",
        "stabilize_window",
        "reopen_if_regresses"
      ],
      "properties": {
        "measurement_boundary": {
          "type": "string",
          "minLength": 1,
          "description": "Asset/meter scope or L2 graph node id"
        },
        "related_tag_ids": {
          "type": "array",
          "items": { "type": "string", "minLength": 1 },
          "minItems": 1,
          "description": "L2 tag ids L5 polls — not free-text supporting_tags"
        },
        "clearance_predicate": {
          "type": "object",
          "required": ["metric", "comparator"],
          "properties": {
            "metric": { "type": "string" },
            "comparator": {
              "type": "string",
              "enum": ["lt", "lte", "gt", "gte", "eq", "in_band", "out_of_band"]
            },
            "threshold": { "type": "number" },
            "band_ref": {
              "type": "array",
              "items": { "type": "number" },
              "minItems": 2,
              "maxItems": 2
            },
            "relative_to": {
              "type": "string",
              "enum": ["baseline", "actual_at_detect", "absolute"]
            }
          },
          "additionalProperties": false
        },
        "expected_post_fix_signal": {
          "type": "string",
          "minLength": 1,
          "description": "Human+machine description e.g. SP within band"
        },
        "stabilize_window": {
          "type": "string",
          "minLength": 1,
          "description": "ISO-8601 duration e.g. PT30M"
        },
        "reopen_if_regresses": {
          "type": "object",
          "required": ["enabled"],
          "properties": {
            "enabled": { "type": "boolean" },
            "predicate": {
              "type": "object",
              "required": ["metric", "comparator"],
              "properties": {
                "metric": { "type": "string" },
                "comparator": {
                  "type": "string",
                  "enum": ["lt", "lte", "gt", "gte", "eq", "in_band", "out_of_band"]
                },
                "threshold": { "type": "number" },
                "band_ref": {
                  "type": "array",
                  "items": { "type": "number" },
                  "minItems": 2,
                  "maxItems": 2
                },
                "relative_to": {
                  "type": "string",
                  "enum": ["baseline", "actual_at_detect", "absolute"]
                }
              },
              "additionalProperties": false
            },
            "grace_window": { "type": "string" }
          },
          "additionalProperties": false
        }
      },
      "additionalProperties": false
    },
    "alarm_hint": {
      "type": "object",
      "description": "L3 suggestion only — L5 owns routing/ack/escalate",
      "required": ["severity", "category_code"],
      "properties": {
        "severity": {
          "type": "string",
          "enum": ["info", "warning", "error", "critical"]
        },
        "category_code": {
          "type": "string",
          "minLength": 1,
          "description": "Stable EMS console grouping code"
        }
      },
      "additionalProperties": false
    },
    "dedupe_key": {
      "type": "string",
      "pattern": "^sha256:[a-f0-9]{64}$",
      "description": "Stable key from category + assets + window per L3 spec"
    },
    "md_episode_id": {
      "type": "string",
      "minLength": 1,
      "description": "Non-additive MD episode key when category participates in demand-charge attribution"
    },
    "allocation_share": {
      "type": "number",
      "minimum": 0,
      "maximum": 1,
      "description": "Share of episode_inr_cap attributed to this finding"
    },
    "md_episode": {
      "type": "object",
      "description": "Embedded MD episode snapshot for L5 clearance (non-additive INR cap)",
      "required": [
        "schema_version",
        "md_episode_id",
        "org_id",
        "plant_id",
        "incomer_asset_id",
        "peak_kva",
        "cmd_kva",
        "md_rate_inr_per_kva",
        "episode_inr_cap",
        "period_start",
        "period_end",
        "member_finding_ids",
        "allocation",
        "clearance_status"
      ],
      "properties": {
        "schema_version": { "type": "string", "pattern": "^\\d+\\.\\d+\\.\\d+$" },
        "md_episode_id": { "type": "string", "minLength": 1 },
        "org_id": { "type": "string", "minLength": 1 },
        "plant_id": { "type": "string", "minLength": 1 },
        "incomer_asset_id": { "type": "string", "minLength": 1 },
        "peak_kva": { "type": "number", "minimum": 0 },
        "cmd_kva": { "type": "number", "minimum": 0 },
        "md_rate_inr_per_kva": { "type": "number", "minimum": 0 },
        "episode_inr_cap": { "type": "number", "minimum": 0 },
        "period_start": { "type": "string", "minLength": 1 },
        "period_end": { "type": "string", "minLength": 1 },
        "member_finding_ids": {
          "type": "array",
          "items": { "type": "string", "minLength": 1 },
          "minItems": 1
        },
        "allocation": {
          "type": "array",
          "items": {
            "type": "object",
            "required": ["finding_id", "weight"],
            "properties": {
              "finding_id": { "type": "string", "minLength": 1 },
              "weight": { "type": "number", "minimum": 0, "maximum": 1 }
            },
            "additionalProperties": false
          },
          "minItems": 1
        },
        "clearance_status": {
          "type": "string",
          "enum": ["pending", "cleared", "reopened"]
        }
      },
      "additionalProperties": false
    }
  },
  "additionalProperties": false
}
